{
  "id": "T0004-implement-openai-agent-client",
  "number": 4,
  "slug": "implement-openai-agent-client",
  "title": "Implement OpenAI agent client",
  "description": "Build src/agent.py: AgentClient class with constructor(strategy_prompt, model, api_key). Single method choose_action(world_state_json, tick, hp) → (direction, reasoning). Uses tool-calling with one tool do_action(direction in {N,S,E,W,noop}); tool_choice=\"required\". Returns the chosen direction and the assistant message content as reasoning.",
  "status": "open",
  "estimate": {
    "unit": "hours",
    "value": 2,
    "confidence": "med"
  },
  "acceptance_criteria": [
    "AgentClient instantiates without making a call",
    "choose_action returns a valid direction enum",
    "reasoning is captured as a string (may be empty)",
    "malformed responses raise a clear error (does not silently noop)",
    "strategy_prompt is in the system role on every call"
  ],
  "depends_on": [
    "T0001-bootstrap-repository"
  ],
  "decision_refs": [
    "0003-define-the-agent-action-contract"
  ],
  "priority": "p0",
  "labels": [
    "llm",
    "core"
  ],
  "assignee_hint": "agent",
  "created_at": "2026-05-17T04:14:22.528Z",
  "updated_at": "2026-05-17T04:14:22.528Z"
}
