{
  "id": "T0003-implement-frame-renderer",
  "number": 3,
  "slug": "implement-frame-renderer",
  "title": "Implement frame renderer",
  "description": "Build src/render.py: render_frame(world) -> list[str]. Compose static_tiles + entity glyphs (entity overrides tile). Provide a small HUD line below the frame showing tick number, HP, and last action. Return as list of strings so the game loop can join + print or send to LLM.",
  "status": "open",
  "estimate": {
    "unit": "hours",
    "value": 1,
    "confidence": "high"
  },
  "acceptance_criteria": [
    "render_frame returns 10 strings of length 10",
    "player @ is visible at its current position",
    "HUD line includes tick, hp, last_action",
    "manual visual check: frame looks like a roguelike room"
  ],
  "depends_on": [
    "T0002-implement-world-module-tile-grid-entity-dict"
  ],
  "decision_refs": [
    "0002-define-the-world-representation-and-renderer"
  ],
  "priority": "p0",
  "labels": [
    "core"
  ],
  "assignee_hint": "agent",
  "created_at": "2026-05-17T04:14:22.527Z",
  "updated_at": "2026-05-17T04:14:22.527Z"
}
