{
  "id": "T0002-implement-world-module-tile-grid-entity-dict",
  "number": 2,
  "slug": "implement-world-module-tile-grid-entity-dict",
  "title": "Implement world module (tile grid + entity dict)",
  "description": "Build src/world.py: World dataclass with static_tiles: list[list[str]] and entities: dict[str, dict]. Provide constructors for a default 10×10 room (walls border, one hazard, one exit). Pure data and helpers; no rendering, no game logic.",
  "status": "open",
  "estimate": {
    "unit": "hours",
    "value": 2,
    "confidence": "med"
  },
  "acceptance_criteria": [
    "World.default_room() returns a valid 10x10 with #, ., X, > tiles",
    "entities dict contains a player at a known spawn",
    "is_walkable(x,y) returns False for walls, True for floor and hazard",
    "unit test: default room is fully walkable from spawn to exit"
  ],
  "depends_on": [
    "T0001-bootstrap-repository"
  ],
  "decision_refs": [
    "0002-define-the-world-representation-and-renderer"
  ],
  "priority": "p0",
  "labels": [
    "core"
  ],
  "assignee_hint": "agent",
  "created_at": "2026-05-17T04:14:22.526Z",
  "updated_at": "2026-05-17T04:14:22.526Z"
}
