{
  "id": "T0007-implement-cli-entry-script",
  "number": 7,
  "slug": "implement-cli-entry-script",
  "title": "Implement CLI entry script",
  "description": "Build src/__main__.py: argparse for --strategy (or read from stdin), --model (default gpt-4o), --max-steps (default 50). Construct AgentClient, build default room, call run_game. Print the final outcome. Document the env vars (OPENAI_API_KEY) and a sample invocation in README.",
  "status": "open",
  "estimate": {
    "unit": "hours",
    "value": 1,
    "confidence": "high"
  },
  "acceptance_criteria": [
    "python -m src --strategy \"cautious explorer\" runs end-to-end",
    "README has a complete example invocation",
    "--help prints usage",
    "Exit code 0 on win/timeout, 1 on death (so scripts can chain)"
  ],
  "depends_on": [
    "T0006-implement-the-tick-based-game-loop"
  ],
  "decision_refs": [
    "0001-choose-the-implementation-language",
    "0004-define-the-tick-loop-and-termination-conditions"
  ],
  "priority": "p0",
  "labels": [
    "cli"
  ],
  "assignee_hint": "agent",
  "created_at": "2026-05-17T04:14:22.532Z",
  "updated_at": "2026-05-17T04:14:22.532Z"
}
